{
  "schema": 1,
  "id": "aorta",
  "title": {
    "zh": "主动脉沿路的岔口",
    "en": "Every Turning Off the Aorta"
  },
  "system": "vessels",
  "structures": [
    "aorta",
    "brachiocephalic_trunk",
    "common_carotid_arteries",
    "celiac_trunk",
    "renal_arteries",
    "iliac_arteries",
    "femoral_arteries"
  ],
  "steps": [
    {
      "text": {
        "zh": "全身的动脉血都从同一根管子出发。它从心脏出来先向上，拐个弯，再一路向下穿过躯干。",
        "en": "All the arterial blood in your body sets out from a single tube. It leaves the heart heading up, turns a bend, then runs down through the trunk."
      },
      "layer": 0.1,
      "preset": "front",
      "durationMs": 11000
    },
    {
      "text": {
        "zh": "这就是主动脉，全身最粗的血管。管壁里织着大量弹性纤维，心脏一停跳它还能靠回弹继续推血。",
        "en": "This is the aorta, the widest vessel you have. Its wall is woven with elastic fibres, so between heartbeats it keeps blood moving by springing back."
      },
      "layer": 0.8,
      "selected": "aorta",
      "durationMs": 11500
    },
    {
      "text": {
        "zh": "弓顶上的第一个岔口是头臂干，一根粗短的主干。它一出来立刻又分成两支，同时管右臂和右侧头颈。",
        "en": "The first turning at the top of the arch is the brachiocephalic trunk, short and stout. It splits again at once, serving the right arm and the right side of the head."
      },
      "layer": 0.8,
      "selected": "brachiocephalic_trunk",
      "durationMs": 10500
    },
    {
      "text": {
        "zh": "颈总动脉沿着气管两侧笔直上行。你在下颌角下方按到的那阵搏动，就是它。",
        "en": "The common carotid arteries run straight up either side of the windpipe. That pulse you can find just below the angle of the jaw is this vessel."
      },
      "layer": 0.8,
      "selected": "common_carotid_arteries",
      "durationMs": 9000
    },
    {
      "text": {
        "zh": "过了膈肌，第一个岔口是腹腔干。它只有一两厘米长，却要同时供应肝、胃和脾。",
        "en": "Past the diaphragm, the first turning is the coeliac trunk. Barely a centimetre or two long, it still has to supply the liver, the stomach and the spleen."
      },
      "layer": 0.8,
      "selected": "celiac_trunk",
      "durationMs": 9000
    },
    {
      "text": {
        "zh": "紧接着是左右肾动脉，几乎垂直地横插出去。两个肾拿走的血量，占心脏每次输出的五分之一左右。",
        "en": "Next come the renal arteries, branching off almost at right angles. The two kidneys claim roughly a fifth of everything the heart pumps out."
      },
      "layer": 0.8,
      "selected": "renal_arteries",
      "durationMs": 10000
    },
    {
      "text": {
        "zh": "走到骨盆上缘，主动脉就此终止，一分为二成髂动脉。这里是整条干线的终点，也是双腿的起点。",
        "en": "At the brim of the pelvis the aorta ends, splitting in two as the iliac arteries. This is where the main line stops and both legs begin."
      },
      "layer": 0.8,
      "selected": "iliac_arteries",
      "durationMs": 10000
    },
    {
      "text": {
        "zh": "越过腹股沟，它换名叫股动脉。这根血管位置浅、口径大，急救时常从这里摸脉、也从这里穿刺。",
        "en": "Crossing the groin, it takes a new name: the femoral artery. Shallow and wide, it is a vessel medics reach for both to feel a pulse and to puncture."
      },
      "layer": 0.8,
      "selected": "femoral_arteries",
      "durationMs": 10000
    },
    {
      "text": {
        "zh": "一根主干，沿路不断分岔，越分越细。血从心脏到脚趾，只有一条路，却有无数个出口。",
        "en": "One trunk, branching and rebranching, finer at every step. From heart to toe there is only one road — but countless places to leave it."
      },
      "layer": 0.75,
      "preset": "hero",
      "durationMs": 11000
    }
  ]
}
